{"kind":"GlossaryCurrent","layer":"Current","explorationArtifactRef":"runs/demo/glossary/exploration.yaml","glossary":{"glossaryId":"support_issue_shared_vocabulary","scope":{"productArea":"客户支持门户","scenario":"提交并追踪支持请求","languagePolicy":"展示数据统一使用中文；契约、代码和智能体可使用机器标识，但含义必须追溯到中文术语。","sourceRefs":["artifact:user-journey/current.yaml","artifact:flow-model/current.yaml","artifact:low-fi-prototype/current.yaml","artifact:capability-map/current.yaml"]},"terms":[{"termId":"support_issue","canonicalTerm":"支持请求","userFacingTerm":"支持请求","domainTerm":"支持请求领域对象","contractTerm":"支持请求契约字段","codeTerm":"支持请求代码标识","definition":"客户提交并追踪的、需要产品或支持团队响应且需要进展可见的问题记录。","contextMeanings":[{"contextId":"user_journey","meaning":"客户希望被解决的问题。","artifactRefs":["artifact:user-journey/current.yaml#goal"]},{"contextId":"domain_support","meaning":"具有身份、状态、证据和解决生命周期的领域对象。","artifactRefs":["artifact:domain-design/current.yaml#SupportIssue"]},{"contextId":"ui_spec","meaning":"客户可见界面展示为“支持请求”的概念。","artifactRefs":["artifact:ui-spec/current.yaml#status_timeline"]}],"aliases":{"accepted":["问题","支持问题"],"discouraged":["工单"],"forbidden":["案件"]},"relatedTerms":{"narrower":["evidence_package","status_update","resolution"],"related":["sla_visibility"]},"ownerArtifact":"domain-design","status":"approved","confidence":"high","sourceRefs":["artifact:user-journey/current.yaml#goal","artifact:flow-model/current.yaml#submit_issue"],"reviewTrace":{"decisionRef":"decision:glossary-support-issue","rationale":"界面保留客户语言，领域和契约使用稳定标识，但含义统一追溯到中文术语。"}},{"termId":"evidence_package","canonicalTerm":"问题证据","userFacingTerm":"问题证据","domainTerm":"问题证据领域对象","contractTerm":"问题证据契约字段","codeTerm":"问题证据代码标识","definition":"用于分类或解决支持请求的一组文件、文字说明、截图、日志和引用。","contextMeanings":[{"contextId":"flow_model","meaning":"证据就绪度和证据缺失恢复路径。","artifactRefs":["artifact:flow-model/current.yaml#request_evidence"]},{"contextId":"prototype","meaning":"上传区域、检查清单和草稿保存行为。","artifactRefs":["artifact:low-fi-prototype/current.yaml#evidence_request"]}],"aliases":{"accepted":["证据","问题证据"],"discouraged":["附件"],"forbidden":[]},"relatedTerms":{"broader":["support_issue"]},"ownerArtifact":"domain-design","status":"approved","confidence":"medium","sourceRefs":["artifact:flow-model/current.yaml#request_evidence","artifact:low-fi-prototype/current.yaml#evidence_request"]}]},"alignmentMatrix":[{"termId":"support_issue","journey":"问题 / 支持问题","flow":"提交支持请求","prototype":"支持请求状态","capability":"引导式问题录入","domain":"支持请求领域对象","ui":"支持请求","contract":"支持请求契约字段","agentPrompt":"使用 support_issue 这个术语标识；面向用户回复时不要称为“案件”。"},{"termId":"evidence_package","journey":"需要证据","flow":"请求补充证据","prototype":"证据上传和检查清单","capability":"证据就绪度检查","domain":"问题证据领域对象","ui":"问题证据","contract":"问题证据契约字段","agentPrompt":"将证据理解为文件加事实说明，不要只理解为附件。"}],"decisionTrace":{"selectedOptionId":"split_user_domain_internal","rationale":"保持用户可见语言清晰，同时让领域、界面、契约的映射显式可追踪。","reviewer":"acas_operator","reviewedAt":"2026-05-19T10:00:00Z","clarificationAnswers":[{"questionId":"q_case_alias","selectedOptionId":"forbid_case","answer":"禁止在客户可见界面和智能体回复中使用“案件”。","resultingChange":"support_issue.aliases.forbidden 包含“案件”。"},{"questionId":"q_attachment_alias","selectedOptionId":"discourage_attachment","answer":"弱化“附件”，优先使用“问题证据”。","resultingChange":"evidence_package.aliases.discouraged 包含“附件”。"}]},"qualityGate":{"status":"pass","checks":[{"findingId":"qg_source_refs","severity":"info","message":"已审术语都有来源引用。","termIds":["support_issue","evidence_package"]},{"findingId":"qg_forbidden_aliases","severity":"info","message":"“案件”已明确禁止用于客户可见界面。","termIds":["support_issue"]}]},"openRisks":[{"findingId":"risk_owner_sla_language","severity":"warning","message":"负责人和服务等级承诺展示词仍依赖策略评审。","termIds":["support_issue"]}],"evidenceRefs":["artifact:user-journey/current.yaml#goal","artifact:flow-model/current.yaml#submit_issue"]}
